{
  "schemaVersion": 1,
  "encoding": "rle-layered-sector-v1",
  "size": 48,
  "tileOrder": "x-major-y-minor",
  "runs": [
    {
      "count": 384,
      "tile": {
        "elevation": 8,
        "texture": 3,
        "overlay": 2,
        "roof": 1,
        "verticalWall": 1,
        "horizontalWall": 1,
        "diagonalWall": 1
      }
    },
    {
      "count": 384,
      "tile": {
        "elevation": 0,
        "texture": 1,
        "overlay": 0,
        "roof": 0,
        "verticalWall": 0,
        "horizontalWall": 0,
        "diagonalWall": 0
      }
    },
    {
      "count": 384,
      "tile": {
        "elevation": 4,
        "texture": 2,
        "overlay": 0,
        "roof": 0,
        "verticalWall": 0,
        "horizontalWall": 0,
        "diagonalWall": 0
      }
    },
    {
      "count": 384,
      "tile": {
        "elevation": 0,
        "texture": 1,
        "overlay": 0,
        "roof": 0,
        "verticalWall": 0,
        "horizontalWall": 0,
        "diagonalWall": 0
      }
    },
    {
      "count": 768,
      "tile": {
        "elevation": 0,
        "texture": 0,
        "overlay": 0,
        "roof": 0,
        "verticalWall": 0,
        "horizontalWall": 0,
        "diagonalWall": 0
      }
    }
  ]
}
